{
  "schema_version": "1.0",
  "run_id": "rc-001",
  "finding_id": "RC-001",
  "requirement": {
    "id": "AC-001",
    "text": "invoice_no is an opaque string identifier at the application input boundary. The application must preserve the received identifier unchanged through ingestion, storage, and retrieval. The application must not infer numeric or any other type-specific semantics from the identifier string. Transformations such as integer coercion, padding removal, or case folding are prohibited. Observable requirement: After a record with invoice_no = X is imported, a lookup by invoice_no = X must return that record and the stored invoice_no field must equal X byte-for-byte.",
    "classification": "documented",
    "sources": [
      {
        "kind": "application-contract",
        "artifact": "docs/application-contract.md",
        "locator": "Lines 10–24, section 'AC-001 — Invoice identifier preservation'",
        "excerpt": "The application must not infer numeric or any other type-specific semantics from the identifier string. Transformations such as integer coercion, padding removal, or case folding are prohibited."
      },
      {
        "kind": "source-notes",
        "artifact": "docs/source-notes.md",
        "locator": "Lines 36–40, section 'Relationship to our application contract'",
        "excerpt": "Our contract (AC-001) treats invoice_no as an opaque string. The application must not rely on publisher-specific identifier conventions."
      }
    ]
  },
  "assumption": {
    "description": "The _normalize function assumes invoice_no is always a pure numeric string. It applies str(int(record[\"invoice_no\"])) which coerces to integer then back to string. This silently strips leading zeros from identifiers such as \"053636\" (producing \"53636\") and raises ValueError for non-numeric identifiers.",
    "code_artifact": "sample_app/importer.py",
    "symbol": "_normalize"
  },
  "counterexample": {
    "kind": "input-record",
    "fixture": null,
    "record_ids": ["rc-001"],
    "expected_behavior": "After importing {\"source_record_id\": \"rc-001\", \"invoice_no\": \"053636\", ...}, a lookup by invoice_no=\"053636\" must return exactly one record whose stored invoice_no field equals \"053636\" byte-for-byte. Counterexample provenance: synthetic, contract-derived. Not extracted from or representative of any record in the UCI Online Retail dataset (see docs/source-notes.md)."
  },
  "acceptance": {
    "decision": "accepted",
    "reviewer": "developer (explicit ACCEPT reply)",
    "timestamp": "2026-09-26T08:42:00+00:00",
    "protected_manifest": "runs/rc-001/protected-manifest.json"
  },
  "regression": {
    "test_artifact": "tests/regression/test_rc001_invoice_no_preservation.py",
    "node_ids": [
      "tests/regression/test_rc001_invoice_no_preservation.py::test_leading_zero_invoice_no_preserved"
    ],
    "expected_failure": "On the unmodified application, _normalize strips the leading zero from \"053636\" producing \"53636\" before storage. The lookup by \"053636\" returns zero rows, so the assertion len(results) == 1 fails with AssertionError: Lookup by original invoice_no='053636' returned no rows."
  },
  "executions": {
    "reproduction": {
      "execution_id": "df96ba74-10dd-4505-87e7-b7136736d835",
      "phase": "reproduction",
      "outcome": "failed",
      "artifact_dir": "runs/rc-001/df96ba74-10dd-4505-87e7-b7136736d835"
    },
    "verification": {
      "execution_id": "5fb09aa4-2f09-4ff5-83ef-ca717c023f6b",
      "phase": "verification",
      "outcome": "passed",
      "artifact_dir": "runs/rc-001/5fb09aa4-2f09-4ff5-83ef-ca717c023f6b"
    },
    "baseline": {
      "execution_id": "fae0e1d9-b45a-475c-8dbc-e384fcdd32e6",
      "phase": "verification",
      "outcome": "passed",
      "artifact_dir": "runs/rc-001/fae0e1d9-b45a-475c-8dbc-e384fcdd32e6"
    },
    "independent": null
  },
  "repair": {
    "base_snapshot": "3e7416b56e789479b88372315cba35b816da91b4906dd64c2509b04a0e8ef87b",
    "candidate_snapshot": "a0efceb71f4b664c039a14166eecf71d80825798c526a758c7a65ca8c5f7a4c1",
    "patch": "diff --git a/sample_app/importer.py b/sample_app/importer.py\nindex c429e27..3bc10ae 100644\n--- a/sample_app/importer.py\n+++ b/sample_app/importer.py\n@@ -13,7 +13,7 @@ from sample_app import database\n \n def _normalize(record: Dict[str, Any]) -> Dict[str, Any]:\n     \"\"\"Return a normalized copy of *record* ready for storage.\"\"\"\n-    normalized_invoice = str(int(record[\"invoice_no\"]))\n+    normalized_invoice = str(record[\"invoice_no\"])\n     return {\n         \"source_record_id\": str(record[\"source_record_id\"]),\n         \"invoice_no\": normalized_invoice,\n"
  },
  "verdict": {
    "status": "verified_for_tested_scenarios",
    "reason": "Verification execution passed all required tests",
    "limitations": [
      "Verdict covers only the tested scenarios — not all contract requirements.",
      "The counterexample input (invoice_no=\"053636\") is synthetic and contract-derived. It is not extracted from the UCI Online Retail dataset.",
      "AC-002 and AC-003 are not independently regression-tested in this run."
    ]
  }
}
